{
  "kind": "review-decision",
  "contractVersion": "2.0.0",
  "id": "synthetic/pio-like/decision-2",
  "version": "1.0.0",
  "body": {
    "snapshotRef": {
      "kind": "interpretation-snapshot",
      "id": "synthetic/pio-like/snapshot",
      "version": "1.0.0",
      "digest": "8da4a51645761e01196c43c13562a51c311e2a72f23d660073fb9e8d25d4ee96"
    },
    "target": {
      "type": "issue",
      "id": "u.count-source"
    },
    "decision": "needs-evidence",
    "evidenceBasis": "declared-by-reviewer",
    "reviewer": "synthetic reviewer",
    "reason": "connection plc2 has to be found in another export before Line1.Count can be judged",
    "decidedAt": "2026-10-22T00:01:00Z",
    "previousDecisionDigest": "1e3f72bf17a51a5cfca1535d6e690fc1ec1fb6f9d4538bd4a7be9b6281ab1ebf",
    "evidenceRefs": []
  },
  "digest": "b7989c6283b4b1d006c9c66e6315baa5ae9168ce5503141d77346846c43440e9"
}
