{
  "kind": "review-decision",
  "contractVersion": "2.0.0",
  "id": "synthetic/pio-like/decision-1",
  "version": "1.0.0",
  "body": {
    "snapshotRef": {
      "kind": "interpretation-snapshot",
      "id": "synthetic/pio-like/snapshot",
      "version": "1.0.0",
      "digest": "8da4a51645761e01196c43c13562a51c311e2a72f23d660073fb9e8d25d4ee96"
    },
    "target": {
      "type": "claim",
      "id": "c.temp-scale"
    },
    "decision": "confirm",
    "evidenceBasis": "declared-by-reviewer",
    "reviewer": "synthetic reviewer",
    "reason": "the scale matches the synthetic configuration sheet",
    "decidedAt": "2026-10-22T00:00:00Z",
    "previousDecisionDigest": null,
    "evidenceRefs": [
      "synthetic configuration sheet, row Line1.Temp"
    ]
  },
  "digest": "1e3f72bf17a51a5cfca1535d6e690fc1ec1fb6f9d4538bd4a7be9b6281ab1ebf"
}
